{
  "schema_version": "1",
  "artifact_type": "plan-execution",
  "plan_id": "FS0-GENESIS",
  "stages": [
    {
      "order": 1,
      "id": "portable-root-surface",
      "file_change_ids": [
        "GEN-FILE-017",
        "GEN-FILE-018",
        "GEN-FILE-019"
      ]
    },
    {
      "order": 2,
      "id": "design-substrate",
      "file_change_ids": [
        "GEN-FILE-003",
        "GEN-FILE-004"
      ]
    },
    {
      "order": 3,
      "id": "authority-substrate",
      "file_change_ids": [
        "GEN-FILE-001",
        "GEN-FILE-002",
        "GEN-FILE-005"
      ]
    },
    {
      "order": 4,
      "id": "planning-substrate",
      "file_change_ids": [
        "GEN-FILE-006"
      ]
    },
    {
      "order": 5,
      "id": "governance-substrate",
      "file_change_ids": [
        "GEN-FILE-007"
      ]
    },
    {
      "order": 6,
      "id": "conformance-substrate",
      "file_change_ids": [
        "GEN-FILE-008",
        "GEN-FILE-009",
        "GEN-FILE-010"
      ]
    },
    {
      "order": 7,
      "id": "ci-evidence-substrate",
      "file_change_ids": [
        "GEN-FILE-016"
      ]
    },
    {
      "order": 8,
      "id": "assurance-substrate",
      "file_change_ids": [
        "GEN-FILE-011",
        "GEN-FILE-012"
      ]
    },
    {
      "order": 9,
      "id": "build-state-substrate",
      "file_change_ids": [
        "GEN-FILE-013",
        "GEN-FILE-014"
      ]
    },
    {
      "order": 10,
      "id": "evidence",
      "file_change_ids": [
        "GEN-FILE-015"
      ]
    },
    {
      "order": 11,
      "id": "successor-proof",
      "action": "Exercise one ordinary successor framework functional set using only the established framework lifecycle; no Genesis-specific semantic bypass is permitted."
    }
  ]
}
